Event Name,Domain,Month,Organizer,Description,Contact Information,Event Type,college_location,City
Phased hybrid encoding,Tech,January,NextGen Events,Security name decade factor.,mclaughlintammy@example.net,Paper Presentation,SSN College of Engineering,Chennai
Exclusive contextually-based product,Sports,February,Future Builders,Goal break evening share but during floor measure street ability.,laurennelson@example.net,Technical Event,KPR Institute of Engineering and Technology,Coimbatore
Re-engineered 24/7 collaboration,Environment,May,Tech Titans,Development dinner radio understand surface career.,hyoung@example.net,Conference,PSG Institute of Technology and Applied Research,Coimbatore
Decentralized clear-thinking core,Business,June,Future Builders,Fire project paper all you.,carterwhitney@example.com,Seminar,KPR Institute of Engineering and Technology,Coimbatore
Seamless high-level open architecture,Tech,December,Society of Innovators,Perform phone view little guess industry how figure approach.,fleminggary@example.net,Paper Presentation,PSG Institute of Technology and Applied Research,Coimbatore
Networked asymmetric encoding,Web Development,January,EventHub,Well air behavior nice pressure watch.,mitchelllisa@example.com,Expo,NIT Trichy,Trichy
Mandatory systemic success,Education,February,Future Builders,Yourself heavy enough describe woman finally along game.,dbrooks@example.net,Conference,NIT Trichy,Trichy
Integrated national archive,Web Development,July,Future Builders,Speech real newspaper moment.,vchan@example.com,Expo,KPR Institute of Engineering and Technology,Coimbatore
Stand-alone optimizing implementation,Electrical,December,NextGen Events,Question wear religious them travel available measure writer.,kramermanuel@example.com,Seminar,KPR Institute of Engineering and Technology,Coimbatore
Customizable tangible core,Electrical,April,World Council,Bring home cold short question trade market instead speak positive.,derrick97@example.net,Paper Presentation,NIT Trichy,Trichy
Team-oriented tangible capacity,Business,December,Tech Titans,Performance husband personal difference security system east.,bgomez@example.org,Paper Presentation,PSG Institute of Technology and Applied Research,Coimbatore
Integrated fault-tolerant encryption,Education,August,EventHub,Animal effort right question pay newspaper one.,lambertkimberly@example.org,Non-Technical Event,KPR Institute of Engineering and Technology,Coimbatore
Cross-platform dedicated throughput,Cybersecurity,April,Tech Titans,Fish join west use use.,james72@example.com,Technical Event,SSN College of Engineering,Chennai
Devolved incremental firmware,Environment,August,NextGen Events,Social these book medical half former require much whom.,vasquezcassandra@example.com,Networking,SSN College of Engineering,Chennai
Visionary transitional initiative,Business,January,Future Builders,Near official student property feeling would.,michaelgrimes@example.org,Networking,PSG Institute of Technology and Applied Research,Coimbatore
Operative asynchronous database,Web Development,November,Tech Innovators,Production special care make make result show.,elizabeth43@example.net,Paper Presentation,NIT Trichy,Trichy
